{
  "schema_version": 1,
  "session_id": "sess-fixture-timeout-forced",
  "tool": "bash",
  "command": "echo neutral",
  "features": {
    "executed": true,
    "bulk_outbound": false,
    "vip": false,
    "same_intent": null,
    "recipient_count": null,
    "recipient_class": null,
    "amount": null,
    "currency": null,
    "paths": [],
    "effect_hints": [],
    "pack_id": null,
    "namespace": null,
    "rule_id": null
  },
  "thresholds": {
    "bulk_recipient_min": 1000,
    "vip_list_path": null
  },
  "meta": {
    "host": "fixture-timeout-forced",
    "cwd": null
  }
}
